Tweet,User,User_ID,Geo,HashTag,Date
"Al regresar a casa, tenga cuidado con las fugas de gas natural. Si huele a gas, aléjese y llame al 911. La Supervisora @lyndajbhopkins ofrece consejos sobre la seguridad del gas natural al volver a ingresar a su hogar. http://bit.ly/2JAgb4M #Kincadefire #Sonomafuerte",CountyofSonoma,54319670,,#Kincadefire #Sonomafuerte,Wed Oct 30 21:32:57 +0000 2019
"When returning home, be cautious natural gas leaks. If you smell gas, get away and call 911. Sonoma County Supervisor @lyndajbhopkins offers advice on natural gas safety when re-entering your home. http://bit.ly/2JAgb4M #Kincadefire #SonomaStrong",CountyofSonoma,54319670,,#Kincadefire #SonomaStrong,Wed Oct 30 21:32:37 +0000 2019
". @Cal_Fire abrió estas zonas para repoblación: Zonas 8A, 8B, 7, 4B. Órdenes de evacuación reducidas a ADVERTENCIA DE EVACUACIÓN en la Zona 1A, 3A, 3B, 5A, 5B. Todas las órdene /advertencias de evacuación para zonas no identificadas arriba vigentes. http://bit.ly/2Nt8Kxk",CountyofSonoma,54319670,,,Wed Oct 30 21:21:14 +0000 2019
". @Cal_Fire opened these zones for repopulation -Zone 8A, Zone 8B, Zone 7, Zone 4B. Evacuation Orders reduced to EVACUATION WARNING in Zone 1A, Zone 3A, Zone 3B, Zone 5A, Zone 5B. All evacuation orders/warnings for zones not identified above remain in place http://bit.ly/2Nt8Kxk",CountyofSonoma,54319670,,,Wed Oct 30 21:12:25 +0000 2019
"Durante un desastre, es común que aumente la ansiedad, desesperación, preocupación, irritabilidad y la ira. No está solo y merece apoyo. La Supervisora @ShirleeZane ofrece información sobre los servicios disponibles para los residentes del Condadohttp://bit.ly/2WsjT5D",CountyofSonoma,54319670,,,Wed Oct 30 21:00:50 +0000 2019
"During a disaster, it’s common to have increased anxiety, hopelessness, worry, irritability, and anger. You’re not alone and deserve support. Sonoma County Supervisor @ShirleeZane offers information on available services to Sonoma County residents http://bit.ly/2WsjT5D",CountyofSonoma,54319670,,,Wed Oct 30 21:00:33 +0000 2019
"Apoye las víctimas con una donación financiera, pueden usar según lo necesiten. Por favor, asistir las organizaciones que ya estan envolucrados. Alimentos, ropa, y artículos de hogar no se pueden aceptar en este momento, se pueden agobiar los esfuerzos. https://bit.ly/2PExdT1",CountyofSonoma,54319670,,,Wed Oct 30 20:20:16 +0000 2019
"Support victims with a financial donation, which they can use as they need. Please give to relief organizations already engaged in the response. Food, clothing and household items are not being accepted at this time as they can overwhelm relief efforts.https://bit.ly/2PExdTl",CountyofSonoma,54319670,,,Wed Oct 30 20:19:59 +0000 2019
"For the next few days, overnight temperatures are expected to drop into the 30s. Since many residents will be without power, they should follow cold weather safety tips found at: https://socoemergency.org/cold-weather-code-blue-advisory/ …pic.twitter.com/45YICwyOf4",CountyofSonoma,54319670,,,Wed Oct 30 20:00:52 +0000 2019
"Para los proximos dias, se esperan bajas temperaturas por la noche que bajen as los 30 grados. Ya que varios residentes estarán sin energía, residentes deberían de seguir consejos de para el clima frío, visite: https://socoemergency.org/aviso-de-clima-frio-codigo-azul/ …pic.twitter.com/UwxxNfevSu",CountyofSonoma,54319670,,,Wed Oct 30 20:00:52 +0000 2019
What happens to the mail? USPS has info on interrupted service at https://about.usps.com/newsroom/service-alerts/weather-updates-residential.htm …,CountyofSonoma,54319670,,,Wed Oct 30 19:51:48 +0000 2019
¿Qué pasa con el correo? USPS tiene información sobre la interrupción de servicio en: https://about.usps.com/newsroom/service-alerts/weather-updates-residential.htm …,CountyofSonoma,54319670,,,Wed Oct 30 19:51:08 +0000 2019
El Redwood Empire Food Bank ha desplegado distribuciones de respuesta de emergencia Station 3990. Estas distribuciones sirven a cualquier persona que necesite comida. Más información enhttp://bit.ly/2NpZolV,CountyofSonoma,54319670,,,Wed Oct 30 19:15:54 +0000 2019
"The Redwood Empire Food Bank has deployed its emergency response program, Station 3990. These distributions are open to anyone in need of food. More information http://bit.ly/2NpZolV #Kincadefire #SonomaStrong",CountyofSonoma,54319670,,#Kincadefire #SonomaStrong,Wed Oct 30 19:12:26 +0000 2019
Alimentos y medicamentos refrigerados pueden ser inseguros si no hay electricidad por más de 4 horas. Puede haberse calentado y debe desecharse. La Supervisora @lyndajbhopkins ofrece consejos sobre seguridad alimentaria http://bit.ly/2WrcQKx Información:http://bit.ly/322Scl4,CountyofSonoma,54319670,,,Wed Oct 30 18:44:18 +0000 2019
Food and refrigerated medicine may be unsafe if the power is out for more than 4 hours. It may have become warm and should be disposed of. Sonoma County Supervisor @lyndajbhopkins offers advice on food safety http://bit.ly/2WrcQKx More info at http://bit.ly/322Scl4,CountyofSonoma,54319670,,,Wed Oct 30 18:43:29 +0000 2019
"Animal Services necesita bandejas de lasaña para contener comida y agua para los animales al aire libre. Si puede ayudar, entréguelos al Salon de Veteranos en los Terrenos de la Feria del Condado de Sonoma. Detalles Aqui http://bit.ly/2JwMjpJ #SonomaStrong #Kincadefirepic.twitter.com/uH0VVEpDzM",CountyofSonoma,54319670,,#SonomaStrong #Kincadefirepic,Wed Oct 30 18:05:33 +0000 2019
"Sonoma County Animal Services needs lasagna pans to contain the food and water for outdoor animals. If you can help, please deliver them to the Veteran’s Hall building next to the Sonoma County Fairgrounds. Click here for details http://bit.ly/2JwMjpJ #SonomaStrong #Kincadefirepic.twitter.com/BYh3VW5jgV",CountyofSonoma,54319670,,#SonomaStrong #Kincadefirepic,Wed Oct 30 18:04:56 +0000 2019
¿Qué pasa con el correo? USPS tiene información sobre la interrupción de servicio en: https://about.usps.com/newsroom/service-alerts/ … #kincadefire #kincade #sonomacounty,CountyofSonoma,54319670,,#kincadefire #kincade #sonomacounty,Wed Oct 30 18:01:02 +0000 2019
What happens to the mail? USPS has info on interrupted service at https://about.usps.com/newsroom/service-alerts/ … #kincadefire #kincade #sonomacounty,CountyofSonoma,54319670,,#kincadefire #kincade #sonomacounty,Wed Oct 30 18:01:01 +0000 2019
"Centros de Recursos Comunitarios de PG&E Abiertos de 8:00 am hasta 8:00 pm; estas no son refugios nocturnos. Son estaciones de recarga, y hay agua embotellada y bocadillos disponibles. https://socoemergency.org/shelters-y-centros-de-calefaccion/ …pic.twitter.com/gqoA1AbOav",CountyofSonoma,54319670,,,Wed Oct 30 17:31:05 +0000 2019
"PG&E Community Resource Centers Open 8:00 am – 8:00 pm; these are not overnight shelters. They are charging stations, and bottled water and snacks are available. Click here for details http://bit.ly/321MsrE pic.twitter.com/5O51uYEtbi",CountyofSonoma,54319670,,,Wed Oct 30 17:26:02 +0000 2019
"Agradezemos @SBCityFirePIO por ayudar a @ASPCA con el rescate de una oveja enredada en un alambre alrededor de sus piernas y torso. SBCF la encontró y llamó a Animal Services para pedir ayuda. Para ver el rescate en acción, visite http://bit.ly/2NrdLX7 #SonomaStrong",CountyofSonoma,54319670,,#SonomaStrong,Wed Oct 30 17:21:05 +0000 2019
"Shout out to @SBCityFirePIO for assisting the @ASPCA with the rescue of a sheep entangled in wire around her legs and torso. SBCF found her and called Animal Services for help. To see the rescue in action, click http://bit.ly/2NrdLX7 #SonomaStrong #Kincadefire",CountyofSonoma,54319670,,#SonomaStrong #Kincadefire,Wed Oct 30 17:19:43 +0000 2019
"For residents left unsheltered due to evacuations, daytime warming and charging centers are open in Guerneville and Cloverdale. Remember, we’re #Sonomastrong so take care of yourself, your family, friends and neighbors. For details visit http://SoCoemergency.org . #Kincadefirepic.twitter.com/pfewJFiXsD",CountyofSonoma,54319670,,#Sonomastrong #Kincadefirepic,Wed Oct 30 17:05:36 +0000 2019
"Residentes sin refugio debido a las evacuaciones, centros de calentamiento y carga durante el día están abiertos en Guerneville y Cloverdale. Recuerde, somos #SonomaFuertes, cuide a usted, su familia, amigos y vecinos. Más detalles aqui: http://SoCoemergency.org . #Kincadefirepic.twitter.com/QKnIvGNAbq",CountyofSonoma,54319670,,#SonomaFuertes #Kincadefirepic,Wed Oct 30 17:04:53 +0000 2019
"Durante un desastre, puede aumentar la ansiedad, desesperanza, preocupación, irritabilidad y la ira. Sentirse de esta manera es normal y todos merecemos apoyo mientras procesamos todo lo que ha pasado. Si usted o alguien que conoce necesita ayuda, visitehttps://bit.ly/36gykON",CountyofSonoma,54319670,,,Wed Oct 30 15:57:24 +0000 2019
"During a disaster, it’s common to have increased anxiety, hopelessness, worry, irritability and anger. Feeling this way is normal & we all deserve support as we process all that have gone through. If you or someone you care about needs assistance, visit https://bit.ly/36gykON",CountyofSonoma,54319670,,,Wed Oct 30 15:56:42 +0000 2019
County of Sonoma offices are closed on Wednesday October 30 for emergency operations. Please contact individual departments to check on their availability and services during this time. #kincadefire #kincade #sonomacountypic.twitter.com/7woqtHiKPD,CountyofSonoma,54319670,,#kincadefire #kincade #sonomacountypic,Wed Oct 30 14:01:50 +0000 2019
Siertas oficinas del Condado de Sonoma estarán cerradas el día 30 de octubre para servir a operaciones de emergencia. Por favor comuníquese directamente con el departamento de su necesidad para obtener información de servicios disponibles. #kincadefire #kincade #sonomacountypic.twitter.com/7T1d2M6AGZ,CountyofSonoma,54319670,,#kincadefire #kincade #sonomacountypic,Wed Oct 30 14:01:49 +0000 2019
"Many Sonoma County schools and school districts will be closed through Friday, Nov 1. More information: http://ow.ly/8Fge50wV6Aq Varias escuelas en el Condado y Distritos de Sonoma estarán cerradas hasta el día viernes, 1ro de noviembre. Mas informacion: http://ow.ly/8Fge50wV6Aq pic.twitter.com/CVsTFDJrOu",CountyofSonoma,54319670,,,Wed Oct 30 13:01:31 +0000 2019
Recordatorio de Evacuación Zonas 4A y Zona 7 ha sido reclasificado de orden de evacuación hasta solamente advertencia de evacuación. Todas las demás zonas están bajo orden de evacuación obligatorio. Aviso de bandera roja está en efecto. #kincade #kincadefire #sonomacountypic.twitter.com/NNPoQUNYmp,CountyofSonoma,54319670,,#kincade #kincadefire #sonomacountypic,Wed Oct 30 07:25:54 +0000 2019
Evacuation Reminder Zone 4A and Zone 7 have been downgraded to an Evacuation Warning and residents may cautiously return. All other Zones still under Mandatory Evacuation. NOTE: Red Flag Warning still in effect through Wednesday. #kincade #kincadefire #sonomacountypic.twitter.com/hVUeDBxnfS,CountyofSonoma,54319670,,#kincade #kincadefire #sonomacountypic,Wed Oct 30 07:20:59 +0000 2019
Warming and charging centers have opened in several locations for individuals to warm-up and charge electronic devices. Please visit http://SoCoEmergency.org for more information. #kincadefire #kincade #sonomacountypic.twitter.com/1c6feDqHVR,CountyofSonoma,54319670,,#kincadefire #kincade #sonomacountypic,Wed Oct 30 06:45:03 +0000 2019
"Para obtener el mapa actualizado #KincadeFire, visite https://bit.ly/2pcPHPX . Marque y actualice para obtener la última versión. Ingrese su dirección y amplíe esa ubicación y active o desactive las capas para obtener información específica.",CountyofSonoma,54319670,,#KincadeFire,Wed Oct 30 01:08:23 +0000 2019
"El Alguacil del Condado de Sonoma está bajando la zona 4A: al norte de la intersección de Westside Rd en Mill Creek Rd y oeste del 101, incluye el Norte de Dry Creek Valley, de evacuación obligatoria a alerta de evacuación. Más información en https://bit.ly/2BVYHvi #KincadeFire",CountyofSonoma,54319670,,#KincadeFire,Wed Oct 30 00:01:04 +0000 2019
"The Sonoma County Sheriff is downgrading Zone 4A: north of the intersection of Westside Rd at Mill Creek Rd and west of Hwy 101, including northern Dry Creek Valley from mandatory to evacuation warning. More information at https://bit.ly/2BVYHvi #KincadeFire",CountyofSonoma,54319670,,#KincadeFire,Tue Oct 29 23:59:42 +0000 2019
"Centro de calentamiento abierto en El Salón de Veteranos de Guerneville 16255 1st & Church St Guerneville de 8-8. Bebidas calientes, cobijas y estaciones limitadas de carga de celular disponibles. Tome en cuenta este no es un refugio nocturno. https://bit.ly/2q6EiAY #KincadeFirepic.twitter.com/KbgGVobfNC",CountyofSonoma,54319670,,#KincadeFirepic,Tue Oct 29 23:35:51 +0000 2019
"A daytime warming center open at the Guerneville Veterans Memorial 16255 First & Church Street. Guerneville from 8-8. Hot beverages, blankets and limited cell phone charging stations available. Please note, this is not an overnight shelter. https://bit.ly/2q6EiAY #KincadeFirepic.twitter.com/1NWKmadCHS",CountyofSonoma,54319670,,#KincadeFirepic,Tue Oct 29 23:34:58 +0000 2019
"Para los que buscan un alivio de la mala calidad del aire, los hospitals Santa Rosa Memorial & Petaluma Valley han desplegado 35 depuradores de aire hoy y están dando acceso a sus vestíbulos para escapar del humo. Más lugares: http://socoemergency.org o llame al 211. #Kincadefire",CountyofSonoma,54319670,,#Kincadefire,Tue Oct 29 21:58:29 +0000 2019
"For those seeking respite from poor air quality, Santa Rosa Memorial Hospital & Petaluma Valley Hospital have deployed 35 air scrubbers today & are allowing access to their lobbies in order to escape the smoke. More locations: http://socoemergency.org or call 211. #KincadeFire",CountyofSonoma,54319670,,#KincadeFire,Tue Oct 29 21:58:09 +0000 2019
¿Qué pasa con el correo? USPS tiene información sobre la interrupción de servicio en: https://about.usps.com/newsroom/service-alerts/weather-updates-residential.htm …,CountyofSonoma,54319670,,,Tue Oct 29 21:45:03 +0000 2019
What happens to the mail? USPS has info on interrupted service at https://about.usps.com/newsroom/service-alerts/weather-updates-residential.htm …,CountyofSonoma,54319670,,,Tue Oct 29 21:44:43 +0000 2019
¿Interesado en ayudar a los impactados por el Incendio Kincade? Trabaje con organizaciones de ayuda establecidas involucradas en la respuesta. No se autodespliegue por su seguridad y la seguridad de el personal de emergencias. https://bit.ly/2PExdTl #kincadevolunteer#KincadeFire,CountyofSonoma,54319670,,#kincadevolunteer #KincadeFire,Tue Oct 29 21:28:48 +0000 2019
Interested in helping those impacted by the Kincade Fire? Please work with established relief organizations already involved in the response. Please do not self-deploy for your safety and the safety of first responders. https://bit.ly/2PExdTl #kincadevolunteer #KincadeFire,CountyofSonoma,54319670,,#kincadevolunteer #KincadeFire,Tue Oct 29 21:28:20 +0000 2019
"Durante un desastre, puede aumentar la ansiedad, desesperanza, preocupación, irritabilidad y la ira. Sentirse de esta manera es normal y todos merecemos apoyo mientras procesamos todo lo que ha pasado. Si usted o alguien que conoce necesita ayuda, visitehttps://bit.ly/36gykON",CountyofSonoma,54319670,,,Tue Oct 29 21:16:11 +0000 2019
"During a disaster, it’s common to have increased anxiety, hopelessness, worry, irritability and anger. Feeling this way is normal & we all deserve support as we process all that have gone through. If you or someone you care about needs assistance, visit https://bit.ly/36gykON",CountyofSonoma,54319670,,,Tue Oct 29 21:15:54 +0000 2019
"Thank you for following evacuation orders - it has allowed firefighters and law enforcement officers to focus on their jobs. For updated information about evacuation, visit:https://socoemergency.org/home/emergency/evacuation-orders/ …",CountyofSonoma,54319670,,,Tue Oct 29 19:41:59 +0000 2019
"Si regresa a casa, recuerde que la calidad del aire es deficiente. Quédese adentro y manténgase seguro. Especialmente aquellos con problemas de salud y respiratorio, adultos mayors de edad, mujeres embarazadas. Para obtener más información, visitehttps://bit.ly/2Wokrt9",CountyofSonoma,54319670,,,Tue Oct 29 18:31:05 +0000 2019
"If you're returning home, remember air quality is still poor. Stay inside and stay safe. Especially those with health concerns, older adults, pregnant women or anyone with respiratory issues. For more information visit https://socoemergency.org/air-quality/",CountyofSonoma,54319670,,,Tue Oct 29 18:23:42 +0000 2019
"County of Sonoma offices are closed on Tuesday October 29 for emergency operations. ---- Las oficinas del Condado de Sonoma están cerradas el Martes, 29 de Octubre, para procedimientos de emergencia #kincadefire #kincadepic.twitter.com/2WHAohk6du",CountyofSonoma,54319670,,#kincadefire #kincadepic,Tue Oct 29 03:05:09 +0000 2019
"Por favor, note aunque pueda regresar a su hogar o negocio, el acceso a Internet y Wi-Fi no necesariamente estarán disponible. Las torres de celulares aún pueden verse afectadas por cortes de energía y actividad de incendios. #KincadeFire",CountyofSonoma,54319670,,#KincadeFire,Tue Oct 29 02:49:11 +0000 2019
"Please note, upon return to your home, the Internet and Wi-Fi may not be available. Cell towers may still be impacted from power shutoffs and fire activity. #KincadeFire",CountyofSonoma,54319670,,#KincadeFire,Tue Oct 29 02:48:50 +0000 2019
Tips for when you return home: https://youtu.be/X53pYKJK2vo #KincadeFire #SafetyTips,CountyofSonoma,54319670,,#KincadeFire #SafetyTips,Tue Oct 29 01:20:14 +0000 2019
Consejos Para Cuando Regrese a Casa: https://youtu.be/r0s6Uz1akfU #KincadeFire #Seguridad,CountyofSonoma,54319670,,#KincadeFire #Seguridad,Tue Oct 29 01:19:28 +0000 2019
What happens to the mail? USPS has info on interrupted service at http://about.usps.com/newsroom/service-alerts/weather-updates-residential.htm … https://about.usps.com/newsroom/service-alerts/weather-updates-residential.htm …,CountyofSonoma,54319670,,,Mon Oct 28 22:10:03 +0000 2019
¿Qué pasa con el correo? USPS tiene información sobre la interrupción de servicio en: http://about.usps.com/newsroom/service-alerts/weather-updates-residential.htm … https://about.usps.com/newsroom/service-alerts/weather-updates-residential.htm …,CountyofSonoma,54319670,,,Mon Oct 28 22:10:03 +0000 2019
"For the latest updates and emergency resources, visit http://SoCoEmergency.org and sign-up for SoCoAlerts. To view the Sonoma County Fire and Power Shutoff Incident Map, visit https://tinyurl.com/y643hpgu . To receive Nixle alerts text your zip code to 888777",CountyofSonoma,54319670,,,Mon Oct 28 20:20:00 +0000 2019
Maneras de Mantenerse Informado - SoCoAlerts: sign-up at http://SoCoEmergency.org Mapa de incidentes de incendios y cortes de energía del condado de Sonoma: http://tinyurl.com/y643hpgu . Nixle alerts: Envíe un mensaje de texto con su código postal al 888777,CountyofSonoma,54319670,,,Mon Oct 28 20:17:26 +0000 2019
"No se necesita ID para permanecer en un centro de evacuacion, agencias gubernamentales como ICE, no tendrá acceso a centros de evacuacion. Personal bilingue estára disponible para mantener estos lugares seguros y dar apoyo a todos.http://www.socoemergency.org/home/emergency/centros-de-evacuacion/ …",CountyofSonoma,54319670,,,Mon Oct 28 19:16:26 +0000 2019
"No ID is needed to stay at an evacuation shelter, and Government Agencies, such as ICE, do not have access to the shelters. English and Spanish-speaking staff will be there to make these safe, supportive places for all.http://socoemergency.org/home/emergency/evacuation-centers/ …",CountyofSonoma,54319670,,,Mon Oct 28 19:09:54 +0000 2019
"Las órdenes de evacuación siguen vigentes, aunque se restablezca la electricidad a los hogares. Para obtener la información de evacuación más reciente visite: https://socoemergency.org/home/emergency/evacuation-orders/ …. #kincadefire #sonomacounty",CountyofSonoma,54319670,,#kincadefire #sonomacounty,Mon Oct 28 18:05:44 +0000 2019
Evacuation orders are still in place even if power is restored to homes. https://socoemergency.org/home/emergency/evacuation-orders/ … For latest evacuation information. #kincadefire #sonomacounty,CountyofSonoma,54319670,,#kincadefire #sonomacounty,Mon Oct 28 18:05:18 +0000 2019
Centros de evacuación están abiertos en cumplimiento al incendio Kincade. Visite http://socoemergency.org/home/emergency/centros-de-evacuacion … para una lista de.los Centros de evacuación. **No hay ordenes de evacuacion en Sonoma Raceway** #kincadefire #sonomacounty,CountyofSonoma,54319670,,#kincadefire #sonomacounty,Mon Oct 28 16:56:48 +0000 2019
Evacuation centers are open in response to the Kincade Fire. For list of sites visit http://socoemergency.org/home/emergency/evacuation-centers …. **Sonoma Raceway is not an evacuation center** #kincadefire #sonomacounty,CountyofSonoma,54319670,,#kincadefire #sonomacounty,Mon Oct 28 16:55:52 +0000 2019
"Sonoma County offices are closed on Monday October 28th for emergency operations. Las oficinas del Condado de Sonoma están cerradas el lunes, 28 de octubre, para procedimientos de emergencia #kincadefire #kincadepic.twitter.com/YjpHDeySf4",CountyofSonoma,54319670,,#kincadefire #kincadepic,Mon Oct 28 14:05:04 +0000 2019
"All 40 Sonoma County public school districts will be closed Monday, Oct 28 and Tuesday, Oct 29 Los 40 distritos de escuelas públicas del condado de Sonoma estarán cerrados el lunes 28 de octubre y el martes 29 de octubre http://ow.ly/8Fge50wV6Aq #kincadefire #kincade #sonomacountypic.twitter.com/5zyUyMzvqA",CountyofSonoma,54319670,,#kincadefire #kincade #sonomacountypic,Mon Oct 28 13:05:05 +0000 2019
Information regarding evacuation shelters has now been updated. La información sobre albergues de evacuación ha sido actualizada. https://socoemergency.org/home/emergency/evacuation-centers/ … #kincadefire #sonomastrong #sonomaready,CountyofSonoma,54319670,,#kincadefire #sonomastrong #sonomaready,Mon Oct 28 12:26:17 +0000 2019
"All 40 Sonoma County public school districts will be closed Monday, Oct 28 and Tuesday, Oct 29 Los 40 distritos de escuelas públicas del condado de Sonoma estarán cerrados el lunes 28 de octubre y el martes 29 de octubre http://ow.ly/Pk3650wV6yS #kincadefire #kincade #sonomacountypic.twitter.com/Edxue1JIvL",CountyofSonoma,54319670,,#kincadefire #kincade #sonomacountypic,Mon Oct 28 07:57:11 +0000 2019
Si está bajo de una orden de evacuación obligatoria por #Kincadefire por favor no vaya a su hogar. No está seguro todavía #sonomastrong #sonomaready,CountyofSonoma,54319670,,#Kincadefire #sonomastrong #sonomaready,Mon Oct 28 07:18:44 +0000 2019
If you are under a mandatory evacuation for the #Kincadefire please do not go home. It is still not safe to return. #sonomastrong #sonomaready,CountyofSonoma,54319670,,#Kincadefire #sonomastrong #sonomaready,Mon Oct 28 07:18:19 +0000 2019
Se emitio una order de evacaucion para el area de Markwest /Larkfield Wikiup por un incendio que avanza rapido. Si usted todavia esta en la zona debe evacuar de inmediato. Residentes ya habian sido evacuados. Esto es una advertencia para los que se quedaron. #KincadeFire,CountyofSonoma,54319670,,#KincadeFire,Mon Oct 28 05:49:35 +0000 2019
"An evacuation order has been issued for the Markwest/Larkfield Wikiup area due to a fast moving fire. If still in this area, you need to evacuate immediately. Residents in the area had received evacuations before. This is a warning for those who may have not left. #KincadeFire",CountyofSonoma,54319670,,#KincadeFire,Mon Oct 28 05:48:35 +0000 2019
"Evacuaciones desde Shiloh hasta Old Redwood Hwy, Larkfield Wikiup.https://twitter.com/sonomasheriff/status/1188686523333578753 …",CountyofSonoma,54319670,,,Mon Oct 28 05:40:31 +0000 2019
Evacuation Order Larkfield/Wikiup/Markwest Areas - https://socoemergency.org/evacuation-order-larkfield-wikiup-markwest-areas/ …pic.twitter.com/kKsxHcnFiT,CountyofSonoma,54319670,,,Mon Oct 28 05:32:11 +0000 2019
La Napa Valley Expo ubicado a 575 3rd. st. en Napa está abierto para evacuados. También Napa Valley College centro de evacuación esta lleno. #kincadefire #sonomastrong #sonomaready #napacounty,CountyofSonoma,54319670,,#kincadefire #sonomastrong #sonomaready #napacounty,Mon Oct 28 05:22:57 +0000 2019
The Napa Valley Expo at 575 3rd St in Napa is now open for evacuees. Also the Napa Valley College evacuation center is now at full capacity. #kincadefire #sonomastrong #sonomaready #napacounty,CountyofSonoma,54319670,,#kincadefire #sonomastrong #sonomaready #napacounty,Mon Oct 28 05:18:00 +0000 2019
Peligro de incendio inmediato Wikiup y Larkfield. Los residentes deben evacuar. Immediate fire danger Wikiup and Larkfield. Residents must evacuate. #kindcadefire #sonomastrong #sonomaready,CountyofSonoma,54319670,,#kindcadefire #sonomastrong #sonomaready,Mon Oct 28 04:59:12 +0000 2019
"Solo un recordatorio, @Airbnb ofrece alojamiento temporal gratuito a los evacuados. #KincadeFirehttps://twitter.com/CountyofSonoma/status/1187515931141922817 …",CountyofSonoma,54319670,,#KincadeFirehttps,Mon Oct 28 03:01:15 +0000 2019
Just a reminder that @Airbnb is offering free temporary housing to evacuees. #KincadeFirehttps://twitter.com/CountyofSonoma/status/1187509732002516992 …,CountyofSonoma,54319670,,#KincadeFirehttps,Mon Oct 28 03:00:57 +0000 2019
"PG&E corto el gas a 23,000 clientes para proteger sus hogares del incendio. Incluye las ciudades de Cloverdale a Fulton y Forestville y mas conexiones si es necesario. Cloverdale fue incluida porque las líneas de servicio a la ciudad pasan por el área del incendio.https://twitter.com/wsreports/status/1188545655381250048 …",CountyofSonoma,54319670,,,Mon Oct 28 03:00:04 +0000 2019
