Tweet,User,User_ID,Geo,HashTag,Date
We recommend checking the @PGE4Me page for the latest information: https://www.pge.com/en_US/safety/emergency-preparedness/natural-disaster/wildfires/psps-service-impact-map.page …,CountyofSonoma,54319670,,,Fri Oct 25 18:50:24 +0000 2019
Vea este video para ayudar a usted y a su familia a estar seguros durante los incendios forestales. #KincadeFirehttp://youtu.be/4eZO1e7sGp4,CountyofSonoma,54319670,,#KincadeFirehttp,Fri Oct 25 18:22:30 +0000 2019
Check out this video to help keep yourself and your family safe during wildfires. #KincadeFirehttp://youtu.be/WgnXysO2_7I,CountyofSonoma,54319670,,#KincadeFirehttp,Fri Oct 25 18:21:03 +0000 2019
"Hi! The situation has changed overnight, and the Healdsburg evacuation center is now open again since the Santa Rosa Veterans Memorial is closed. Yes, small animals can come with you to Healdsburg!",CountyofSonoma,54319670,,,Fri Oct 25 18:06:00 +0000 2019
El gobernador Gavin Newsom viajará al condado de Sonoma hoy para visitar comunidades afectadas por el rápido crecimiento del incendio Kincade. El evento se transmitirá públicamente en línea a las 12:15 p.m. en https://www.facebook.com/CALFIRE/,CountyofSonoma,54319670,,,Fri Oct 25 17:54:37 +0000 2019
Governor Newsom will visit communities impacted by the #KincadeFire and hold a media availability this afternoon at 12:15. It will be streamed publicly online at https://www.facebook.com/CALFIRE/,CountyofSonoma,54319670,,#KincadeFire,Fri Oct 25 17:54:32 +0000 2019
"Hi there, Séamus. The videos are captioned - click the ""CC"" button (Closed Captions) in the bottom of the video while its playing to enable the captions. I hope this helps...",CountyofSonoma,54319670,,,Fri Oct 25 16:27:24 +0000 2019
Aviso de Salud De Humo - https://socoemergency.org/aviso-de-salud-de-humo/ …pic.twitter.com/ptBKDiX7pH,CountyofSonoma,54319670,,,Fri Oct 25 02:59:40 +0000 2019
Smoke Health Advisory - https://socoemergency.org/smoke-health-advisory/ …pic.twitter.com/jFxKJ5aOtT,CountyofSonoma,54319670,,,Fri Oct 25 02:56:04 +0000 2019
Calidad del Aire - https://socoemergency.org/calidad-del-aire/ …pic.twitter.com/vtTIUIR5Ur,CountyofSonoma,54319670,,,Fri Oct 25 01:20:56 +0000 2019
Air Quality - https://socoemergency.org/air-quality/ pic.twitter.com/RHjdD6uUTp,CountyofSonoma,54319670,,,Fri Oct 25 01:19:46 +0000 2019
Mira este video para obtener consejos de como viajar con seguridad durante las evacuaciones y los cortes de energía. #KincadeFirehttp://youtu.be/K8MT0g-cpMc,CountyofSonoma,54319670,,#KincadeFirehttp,Fri Oct 25 00:25:15 +0000 2019
Check out this video for tips to travel safe during evacuations and power outages. #KincadeFirehttp://youtu.be/zbBjp7dKbTs,CountyofSonoma,54319670,,#KincadeFirehttp,Fri Oct 25 00:24:35 +0000 2019
#sonomacountystrong #sonomacounty #WeatherForTheWeekAhead #kincaidefire,CountyofSonoma,54319670,,#sonomacountystrong #sonomacounty #WeatherForTheWeekAhead #kincaidefire,Fri Oct 25 00:10:39 +0000 2019
@Airbnb ofrece alojamiento temporal para los evacuados de #KincadeFirepic.twitter.com/68C4peIqUG,CountyofSonoma,54319670,,#KincadeFirepic,Thu Oct 24 23:47:15 +0000 2019
@Airbnb is offering temporary housing for #KincadeFire evacuees. #Kincade #SonomaCounty #geyservillepic.twitter.com/K2pT0m7wlB,CountyofSonoma,54319670,,#KincadeFire #Kincade #SonomaCounty #geyservillepic,Thu Oct 24 23:22:37 +0000 2019
"Una nota del CHP: Seguridad y protección en áreas evacuadas,https://youtu.be/r6eBhXlksn0",CountyofSonoma,54319670,,,Thu Oct 24 22:21:37 +0000 2019
A note from the CHP: Safety and Security in Evacuated Areashttps://youtu.be/atxkP_SYi0c,CountyofSonoma,54319670,,,Thu Oct 24 22:20:32 +0000 2019
"El centro de evacuación en el Centro Comunitario de Healdsburg está al máximo. Personas evacuadas por el incendio de Kincade pueden ir al centro de evacuación en el Salon de Veteranos en Santa Rosa en 1351 Maple, Santa Rosa, CA 95404pic.twitter.com/TkY3CPg4XF",CountyofSonoma,54319670,,,Thu Oct 24 22:12:08 +0000 2019
"The Healdsburg evacuation center is at capacity. Those evacuating from the Kincade Fire may go to the Santa Rosa Veterans Memorial Building evacuation center: 1351 Maple Ave, Santa Rosa, CA 95404 #KincaidFire #Kincade #SonomaCountypic.twitter.com/YIqF8Y8fpL",CountyofSonoma,54319670,,#KincaidFire #Kincade #SonomaCountypic,Thu Oct 24 22:11:53 +0000 2019
The Sonoma County Incident Map provides up-to-date information on all evacuation orders. El Mapa de Incidentes del Condado de Sonoma proporciona información actualizada sobre todas las órdenes de evacuación. https://sonomacounty.maps.arcgis.com/apps/webappviewer/index.html?id=2cb4401e1fc0494dbf9d9e22aa794617 …pic.twitter.com/0zeBvTVvXq,CountyofSonoma,54319670,,,Thu Oct 24 19:36:52 +0000 2019
Incendio de Kincade - Hoja de Datos - https://socoemergency.org/incendio-de-kincade-hoja-de-datos/ …pic.twitter.com/ekd1ScPnlW,CountyofSonoma,54319670,,,Thu Oct 24 19:33:10 +0000 2019
Kincade Fire Fact Sheet - https://socoemergency.org/kincade-fire-fact-sheet/ …pic.twitter.com/YyWmCqk83h,CountyofSonoma,54319670,,,Thu Oct 24 19:32:29 +0000 2019
Kincade Fire Update: Evacuation Centers: http://youtu.be/4vKpAA0PNXo,CountyofSonoma,54319670,,,Thu Oct 24 18:24:21 +0000 2019
Actualización de Kincade Fire: Centros de Evacuacion: http://youtu.be/zuMxpuc1jgk,CountyofSonoma,54319670,,,Thu Oct 24 18:23:33 +0000 2019
Update on #KincadeFire evacuation centers. #SonomaCountypic.twitter.com/E5EBpZYxCw,CountyofSonoma,54319670,,#KincadeFire #SonomaCountypic,Thu Oct 24 17:24:09 +0000 2019
EVAC CENTERS: Sonoma County Fairgrounds is OPEN. Healdsburg Community Center remains open. Windsor HS is closed. La Feria del Condado de Sonoma abrirá a las 8:00AM. El Centro Comunitario de Healdsburg permanece abierto. La Preparatoria de Windsor está cerrado.pic.twitter.com/VoNh50kh4G,CountyofSonoma,54319670,,,Thu Oct 24 16:01:46 +0000 2019
EVAC CENTERS: Sonoma County Fairgrounds will open at 8:00AM. Healdsburg Community Center remains open. Windsor HS is closed. La Feria del Condado de Sonoma abrirá a las 8:00AM. El Centro Comunitario de Healdsburg permanece abierto. La Preparatoria de Windsor está cerrado.pic.twitter.com/jFCYvO4rof,CountyofSonoma,54319670,,,Thu Oct 24 14:11:04 +0000 2019
Fire Info - https://socoemergency.org/fire-info/ pic.twitter.com/xFXsFYjvQb,CountyofSonoma,54319670,,,Thu Oct 24 14:02:10 +0000 2019
Evacuation Order for all Geyserlville residents ***** Orden de evacuacion para todos los residentes de Gyeservillepic.twitter.com/rQDhaD3ybd,CountyofSonoma,54319670,,,Thu Oct 24 14:02:03 +0000 2019
Windsor HS Evac Center will be closing at 7:00 AM. Healdsburg Community Center remains open. No new evacuations. El Centro de Evacuación en Windsor se cerrerá a las 7:00 AM. El Centro Comunitario de Healdsburg permanecere abierto. No hay evacuaciones nuevas. #KincadeFirepic.twitter.com/pcKircSaMc,CountyofSonoma,54319670,,#KincadeFirepic,Thu Oct 24 12:18:46 +0000 2019
"View the interactive map for current evacuation boundaries, evacuation centers, power shut-off areas. Vea el mapa interactivo para ver los límites actuales de evacuación, los centros de evacuación, las áreas de corte de energía. https://bit.ly/2Vr7nD9 #KincadeFirepic.twitter.com/nsf6fVBV08",CountyofSonoma,54319670,,#KincadeFirepic,Thu Oct 24 11:05:10 +0000 2019
"Evacuation Centers Windsor High School - 8695 Windsor Rd, Windsor, CA 95492 Healdsburg Community center - 1557 Healdsburg Ave, **** Centros de evacuación Preparatoria de Windsor - 8695 Windsor Rd, Windsor, CA 95492 Centro Comunitario de Healdsburg - 1557 Healdsburg Ave,pic.twitter.com/sWoxZoIn07",CountyofSonoma,54319670,,,Thu Oct 24 06:54:44 +0000 2019
"Fuego muy grande en Pine Flat Rd en Geyserville, no hay amenaza inmediata para Windsor. Apertura de centro de evacuación en Windsor High Schoolhttps://twitter.com/sonomasheriff/status/1187259265007796224 …",CountyofSonoma,54319670,,,Thu Oct 24 06:50:09 +0000 2019
Fire - Evacuate - https://socoemergency.org/fire-evacuate/ pic.twitter.com/lADiYslqsy,CountyofSonoma,54319670,,,Thu Oct 24 06:47:09 +0000 2019
Please call 2-1-1 for questions and resources about the #KincadeFire Only call 9-1-1 if you need immediate assistance ***** Llame al 2-1-1 con preguntas sobre recursos sobre el incendio #KincadeFire Solo llame al 9-1-1 si necesita asistencia inmediata,CountyofSonoma,54319670,,#KincadeFire #KincadeFire,Thu Oct 24 06:39:52 +0000 2019
"La línea de ayuda para gente afectada por desastres esta diseñada para ayudar a quienes sufran crisis emocionales relacionadas a desastres naturales o causados por humanos. Llame al 1-800-985-5990 y presione ""2"" o envíe un msj de texto al 66746 para hablar con un concejero.",CountyofSonoma,54319670,,,Thu Oct 24 06:28:34 +0000 2019
"The Disaster Distress Helpline, 1-800-985-5990, is a hotline dedicated to providing immediate crisis counseling for people who are experiencing emotional distress related to any natural or human-caused disaster. You can also text 66746 to connect with a trained crisis counselor.",CountyofSonoma,54319670,,,Thu Oct 24 06:26:33 +0000 2019
Hemos recibido reportes de un incendio al norte de Santa Rosa. En este momento NO hay ningun incendio dentro de los limites de la ciudad.https://twitter.com/SantaRosaFire/status/1187247709830504448 …,CountyofSonoma,54319670,,,Thu Oct 24 06:07:28 +0000 2019
Fire alert - https://socoemergency.org/fire-alert/ pic.twitter.com/imgV8Tnlxv,CountyofSonoma,54319670,,,Thu Oct 24 05:47:09 +0000 2019
Evacuaciones emitidas al este de Geyserville en respuesta a un incendio. Manténgase alerta y atento: se publicará más información según esté disponible. #KincaidFire,CountyofSonoma,54319670,,#KincaidFire,Thu Oct 24 05:38:29 +0000 2019
Evacuations issued east of Geyserville in response to a fire. Stay alert and aware - more information will be posted as available.,CountyofSonoma,54319670,,,Thu Oct 24 05:31:17 +0000 2019
"In the event of a power outage, Sonoma County’s water and sewer systems are supported by back-up power - En caso de un corte de energía, los sistemas de agua y alcantarillado del condado de Sonoma están apoyados por energía de respaldo Sonoma Water Visit: http://ow.ly/NtFg50wGm9c pic.twitter.com/vDHgePoIwK",CountyofSonoma,54319670,,,Thu Oct 24 04:00:07 +0000 2019
Call 911 for immediate response from 1st responders. Call 211 for non-emergency event information. Llame al 911 para una respuesta inmediata de los respondedores de emergencia. Llame al 211 para información en un evento que no sea emergencia.pic.twitter.com/ik8JMhJzGr,CountyofSonoma,54319670,,,Thu Oct 24 03:00:06 +0000 2019
"Si está experimentando angustia emocional debido a los recientes cortes de energia en el Condado de Sonoma y sus alrededores, una línea de ayuda nacional gratuita de socorro de desastre está disponible las 24 horas del día, los siete días de la semana. Llame al 1-800-985-5990.pic.twitter.com/XA3Y4xGN0c",CountyofSonoma,54319670,,,Thu Oct 24 02:42:27 +0000 2019
"If you are experiencing emotional distress because of the recent power shutoffs in Sonoma County, a free national Disaster Distress Helpline is available 24 hours a day, seven days a week. For support call 1-800-985-5990 or text TalkWithUs to 66746.pic.twitter.com/sXyJ8KDmRF",CountyofSonoma,54319670,,,Thu Oct 24 02:42:02 +0000 2019
"Los residentes con pozos de agua privados, pompas de agua y sistemas de transmicion al alcantarillado deben estar preparados en caso de un corte de energía. Sepa cómo funciona su sistema de agua y alcantarillado y tenga un plan de respaldo durante una interrupción.pic.twitter.com/3R7jgAIus0",CountyofSonoma,54319670,,,Thu Oct 24 02:00:08 +0000 2019
"Residents with private wells, water pumps and sewer grinder/booster pumps need to be prepared in the event of a power outage. Know how your water and sewer system operates and have a back-up plan during an outage.pic.twitter.com/Y7fAMlyi3N",CountyofSonoma,54319670,,,Thu Oct 24 02:00:07 +0000 2019
Las siguientes escuelas planean estar cerradas el jueves 24 de octubre debido al cierre de energía que esta planificado. Se recomienda que los padres visiten el sitio web de su escuela/distrito para obtener la información más actualizada o visiten http://scoe.org/schoolclosures pic.twitter.com/RlpuUExtnj,CountyofSonoma,54319670,,,Thu Oct 24 00:30:39 +0000 2019
"The following schools plan to be closed Thursday, Oct. 24 due to the planned Power Shutoff. Parents are encouraged to go to their school/district website for the most up to date information or visit http://ow.ly/F8aD50wSCBL .pic.twitter.com/mIISGhbnwC",CountyofSonoma,54319670,,,Thu Oct 24 00:25:55 +0000 2019
Actualización de Corte de Energía por PG&E: http://youtu.be/b3ejxGL-emk #CondadoDeSonoma #SoCoCorteDeEnergía #Actualización,CountyofSonoma,54319670,,#CondadoDeSonoma #SoCoCorteDeEnergía #Actualización,Wed Oct 23 23:38:22 +0000 2019
PG&E Power Shutoff Update: http://youtu.be/wn1zb0Sfy1U #SonomaCounty #SoCoPowerShutoff #Update,CountyofSonoma,54319670,,#SonomaCounty #SoCoPowerShutoff #Update,Wed Oct 23 23:36:30 +0000 2019
"For up-to-date information on PG&E’s Power Shutoff view the latest fact sheet below. Para obtener información actualizada sobre el corte de electricidad de seguridad pública de PG&E, vea la hoja informativa más reciente aquí:http://ow.ly/PkHO50wSzsn",CountyofSonoma,54319670,,,Wed Oct 23 22:46:09 +0000 2019
"PG&E will open Community Resource Centers tomorrow, Thursday October 24. http://ow.ly/KYrG50wSuuP PG&E abrirá Centros de Recursos Comunitarios este jueves, el 24 de Octubre.http://ow.ly/MsdP50wSuuO",CountyofSonoma,54319670,,,Wed Oct 23 22:00:48 +0000 2019
Hoja Informativa Para Distribución Pública Corte De Energía De Pg&E Y Advertencia De Bandera Roja - https://socoemergency.org/hoja-informativa-para-distribucion-publica-corte-de-energia-de-pge-y-advertencia-de-bandera-roja/ …pic.twitter.com/StBWgoY44q,CountyofSonoma,54319670,,,Wed Oct 23 20:51:54 +0000 2019
"PG&E will initiate power shutoffs beginning today at 3pm. For preparedness tips visit: http://ow.ly/7Fwp50wSufW PG&E iniciará cortes de energía a partir de hoy a las 3pm. Para consejos de preparacion, visite:http://ow.ly/wLCX50wSufV",CountyofSonoma,54319670,,,Wed Oct 23 20:13:36 +0000 2019
Power Shutoff Message - https://socoemergency.org/power-shutoff-message/ …pic.twitter.com/QrrGpi7Fll,CountyofSonoma,54319670,,,Wed Oct 23 19:17:05 +0000 2019
"Recurso de la Comunidad: Para averiguar si se verá afectado por los cortes de energía planificados de PG&E, utilice la herramienta de búsqueda de direcciones de PG&E en el siguiente enlace: http://tinyurl.com/yytpstcp pic.twitter.com/eP178ZJ2fj",CountyofSonoma,54319670,,,Wed Oct 23 18:57:46 +0000 2019
Community Resource: To find out if you will be impacted by the planned PG&E Power Shutoffs please use the PG&E address lookup tool at the following link: http://tinyurl.com/y696yve2 .pic.twitter.com/VjGqVlieJh,CountyofSonoma,54319670,,,Wed Oct 23 18:57:23 +0000 2019
PG&E planea realizar un corte de energía que impactaría al Condado de Sonoma desde este miércoles (10/23) en la tarde y durante la manana del jueves (10/24). Manténgase al tanto de su alrededor y esté listo para evacuar si se siente en peligro. Visite: http://SoCoEmergency.org .,CountyofSonoma,54319670,,,Wed Oct 23 18:18:40 +0000 2019
PG&E is planning to conduct a power shutoff that would impact Sonoma County starting this Wednesday (10/23) afternoon through Thursday (10/24). Remain vigilant of your surroundings and be ready to evacuate if you feel unsafe. For regular updates visit: http://SoCoEmergency.org .,CountyofSonoma,54319670,,,Wed Oct 23 18:15:18 +0000 2019
Puede que perdamos la energia manana otra vez. Por favor vean este video con consejos para manejar adecuadamente y evitar accidentes. https://www.facebook.com/CountyofSonoma/posts/10157647184692162?__xts__[0]=68.ARBR4RfEoUWP4hD58pVSQQIdxwnW4-uOpdsU249ZXmzJjQsYc7jBUtgHyQ2bCXxY_y5eN7Tx08knIsTZbPfA7dGB91Cns7fwgEloIy1L-1b5NjqYEuSC97aS7X76iWAoh23NhRohct6QXC-v2icsmD9NiK3Nu_jhhJJacsD3Q1SfP7b3T4ttH14GrL0qD16vP0kMiq6b0OJWxPuJ_fclZGYVRM8BinP_sGr52yx5gQsqO1Jr7whA8fmnbswrZOPjIJZNUGf65I2MmfdrL_4xQjZBq__T2BRGI-U9ad68Od3vc-yFSb5oMldy56bJvT1SjI8OW_rw_kLRFIDb8JNgyPq8ZM9WqIIuVyAQuwyMDndieUcLvG_bTEXaW9cKzAioo_CAyZ4MUNXT_vJVUkedM8iXk1dBV9IQv2fYBsIJVnvBlGuBGx4N-cEDo2nyestPRo0tqXVqABnPTFTfFkrlUI72uJusE5f1Jhkyu_7s23KRLz-x0HaFsc9TtA&__tn__=-R …,CountyofSonoma,54319670,,,Wed Oct 23 00:29:16 +0000 2019
We may lose power again tomorrow. Please watch this video for safe driving tips and to avoid accidents. https://www.facebook.com/CountyofSonoma/posts/10157647186877162?__xts__[0]=68.ARBp9g76OLI8Cq-gg6IbOIqPlA__Wg1aTryE7XDbDhr-bj_p5zlZDPOiy9mB9z3_JYtdStlrn6tF3QbYDcn9aMNAAFHqujmzkE-8bM8wm8ktsKhsAkjXqMzeKN_IujMaPIzWNq727wXukB84-suv2B3y4q1ocGHqCJuXZ0gagD9XiYmYfQ03xrXvtO7eI9a1NU3Ms6NoQGb1FTySgEAA3881mTHdjeqJPfUUXdO1luIuHTbqk2PmVAAX-MVJPnv-0_fcCGfhM59H3utcvoMPd875_GswGSnLadNtyFNaqbpG95cadAom0MYUD0lTD03jf0Vlz3ntq-0pTXR0knMmJQl10YWfAhCW83-bGbxQHq4ehjp0JfJB7JG0G7N7N5x5cPTL6aEdGpcbLSqyjFYSFpW7R1cYERsha1fL2waJ_ONhIxsoPBq-8-XW3OU_UpaDv0V_g8XQZOy2isNc7LgVYbcgI8QwP6gjZ0MTRZ6WSBD8y57_Sx7D&__tn__=-R …,CountyofSonoma,54319670,,,Wed Oct 23 00:28:42 +0000 2019
